{
  "name": "Google Chrome",
  "identifier": "chrome",
  "type": "browser",
  "versions": {
    "stable": {
      "version": "131.0.6778.200"
    }
  },
  "metadata": {
    "last_checked": "2024-12-19T00:19:18.667696Z",
    "check_method": "api",
    "check_url": "https://versionhistory.googleapis.com/v1/chrome/platforms/all/channels/stable/versions"
  }
}
