{
  "name": "Apple Safari",
  "identifier": "safari",
  "type": "browser",
  "versions": {
    "stable": {
      "version": "18.3"
    }
  },
  "metadata": {
    "last_checked": "2024-12-19T00:19:19.834616Z",
    "check_method": "api",
    "check_url": "https://developer.apple.com/tutorials/data/documentation/safari-release-notes.json"
  }
}
