{
  "name": "Mozilla Firefox",
  "identifier": "firefox",
  "type": "browser",
  "versions": {
    "stable": {
      "version": "133.0.3"
    }
  },
  "metadata": {
    "last_checked": "2024-12-19T00:19:19.084988Z",
    "check_method": "api",
    "check_url": "https://product-details.mozilla.org/1.0/firefox_versions.json"
  }
}
